{
  "schemaVersion": 1,
  "type": "sharesync_support_snapshot",
  "platform": "ios",
  "generatedAt": "2026-09-14T05:55:00Z",
  "appVersion": "0.1.0 (1)",
  "phase": "Ready",
  "nextStep": "sync_remaining_photos",
  "transport": "signed_http",
  "endpoint": "Android Pixel - 192.168.1.10:48291",
  "binding": "Paired Android",
  "permissions": {
    "photos": "Allowed"
  },
  "ios": {
    "screenLock": "Preventing lock",
    "manifest": "Ready",
    "batchProgress": "10/12",
    "syncResultReturn": "Posted - 202"
  },
  "sync": {
    "photoCount": 12,
    "remaining": 2,
    "downloaded": 10,
    "imported": 10,
    "failed": 1,
    "partial": 0
  },
  "redaction": {
    "pairingToken": "excluded",
    "requestSignature": "excluded",
    "sharedSecret": "excluded"
  }
}
